{
  "schema_version": "0.1.0",
  "id": "context-budget",
  "title": "Context Budget",
  "summary": "Allocate finite input space across instructions, conversation, tools, memory, and output reserve.",
  "category": "context",
  "status": "core",
  "prerequisites": ["agent-loop"],
  "reference_lessons": ["s06-context-budget"],
  "agent_implementations": [],
  "experiments": ["reference-context-budget-v1"],
  "open_questions": ["Which budget decisions should be replayable across tokenizers?"],
  "reader_layer_status": {"L0": "complete", "L1": "complete", "L2": "complete", "L3": "complete", "L4": "complete"}
}
