{
  "schema_version": "0.1.0",
  "id": "tool-dispatch",
  "title": "Tool Dispatch",
  "summary": "Validate, authorize, execute, and record model-requested tool calls.",
  "category": "tools",
  "status": "core",
  "prerequisites": ["agent-loop", "tool-schema"],
  "reference_lessons": ["s03-tool-dispatch"],
  "agent_implementations": [
    {
      "agent_id": "example-agent",
      "snapshot_id": "example-agent-2026-08-10-cli",
      "coverage": "partial",
      "claim_ids": ["example-agent-tool-dispatch"],
      "notes": "Synthetic mapping used only for schema validation."
    }
  ],
  "experiments": ["example-tool-roundtrip"],
  "open_questions": [
    "Which tool classes are safe to dispatch concurrently?"
  ],
  "reader_layer_status": {
    "L0": "partial",
    "L1": "partial",
    "L2": "missing",
    "L3": "missing",
    "L4": "missing"
  }
}
