{
  "schema_version": "0.1.0",
  "id": "tool-output-truncation",
  "title": "Tool Output Truncation",
  "summary": "Bound oversized tool results while preserving provenance, size, and a useful preview.",
  "category": "context",
  "status": "core",
  "prerequisites": ["tool-dispatch", "context-budget"],
  "reference_lessons": ["s06-context-budget"],
  "agent_implementations": [],
  "experiments": [],
  "open_questions": ["When should output be truncated, summarized, indexed, or stored out of band?"],
  "reader_layer_status": {"L0": "partial", "L1": "complete", "L2": "partial", "L3": "missing", "L4": "missing"}
}
